{  "meta": {
      "language": "system_dynamics",
      "id": "gallery001",
      "name": "single_stock_constant_inflow",
      "label": "Single stock, constant inflow"
   },
   "nodes": {
      "stock1": {
         "id": "stock1",
         "type": "stock",
         "label": "stock1",
         "centrex": 341,
         "centrey": 133,
         "text_shiftx": 1,
         "text_shifty": -22,
         "extras": {
            "equation": {
               "type": "long_text",
               "default_value": "",
               "value": "0"
            },
            "min_value": {
               "type": "short_text",
               "default_value": 0,
               "value": 0
            },
            "max_value": {
               "type": "short_text",
               "default_value": 100,
               "value": 100
            },
            "documentation": {
               "type": "long_text",
               "default_value": "",
               "value": ""
            },
            "comments": {
               "type": "long_text",
               "default_value": "",
               "value": ""
            }
         }
      },
      "cloud1": {
         "id": "cloud1",
         "type": "cloud",
         "label": "cloud1",
         "centrex": 201,
         "centrey": 134,
         "text_shiftx": 0,
         "text_shifty": 25,
         "extras": {
            "equation": {
               "type": "long_text",
               "default_value": "",
               "value": ""
            },
            "min_value": {
               "type": "short_text",
               "default_value": 0,
               "value": 0
            },
            "max_value": {
               "type": "short_text",
               "default_value": 100,
               "value": 100
            },
            "documentation": {
               "type": "long_text",
               "default_value": "",
               "value": ""
            },
            "comments": {
               "type": "long_text",
               "default_value": "",
               "value": ""
            }
         }
      },
      "valve1": {
         "id": "valve1",
         "type": "valve",
         "label": "inflow",
         "centrex": 271,
         "centrey": 133.5,
         "text_shiftx": 0,
         "text_shifty": 19,
         "extras": {
            "equation": {
               "type": "long_text",
               "default_value": "",
               "value": "2"
            },
            "min_value": {
               "type": "short_text",
               "default_value": 0,
               "value": 0
            },
            "max_value": {
               "type": "short_text",
               "default_value": 10,
               "value": 10
            },
            "documentation": {
               "type": "long_text",
               "default_value": "",
               "value": ""
            },
            "comments": {
               "type": "long_text",
               "default_value": "",
               "value": ""
            }
         }
      }
   },
   "arcs": {
      "flow1": {
         "id": "flow1",
         "type": "flow",
         "label": "flow1",
         "start_node_id": "cloud1",
         "end_node_id": "stock1",
         "curvature": 0.3,
         "along": 0.5,
         "select_state": "normal",
         "set_state": "set",
         "node_id": "valve1",
         "shape": "straight",
         "line_colour": "#a0a0a0",
         "line_width": 4,
         "fill_colour": "#a0a0a0",
         "arrowhead": {
            "shape": "diamond",
            "gap": 6,
            "width": 5,
            "front": 12,
            "back": 0
         }
      }
   },
   "scenarios": {
      "default": {
         "simulation_settings": {
            "start_time": 0,
            "end_time": 100,
            "nstep": 100,
            "display_interval": 1,
            "integration_method": "euler1"
         }
      }
   }
}
