{
   "meta": {
      "language": "system_dynamics",
      "id": "aeri_nyoc"
   },
   "nodes": {
      "stock1": {
         "id": "stock1",
         "type": "stock",
         "label": "tank",
         "centrex": 339,
         "centrey": 131,
         "text_shiftx": 1,
         "text_shifty": -22,
         "extras": {
            "equation": {
               "type": "long_text",
               "default_value": "",
               "value": "0"
            },
            "min_value": {
               "type": "short_text",
               "default_value": 0,
               "value": 0
            },
            "max_value": {
               "type": "short_text",
               "default_value": 100,
               "value": 100
            },
            "documentation": {
               "type": "long_text",
               "default_value": "",
               "value": ""
            },
            "comments": {
               "type": "long_text",
               "default_value": "",
               "value": ""
            }
         }
      },
      "cloud1": {
         "id": "cloud1",
         "type": "cloud",
         "label": "cloud1",
         "centrex": 171,
         "centrey": 132,
         "text_shiftx": 0,
         "text_shifty": 25,
         "extras": {
            "equation": {
               "type": "long_text",
               "default_value": "",
               "value": ""
            },
            "min_value": {
               "type": "short_text",
               "default_value": 0,
               "value": 0
            },
            "max_value": {
               "type": "short_text",
               "default_value": 100,
               "value": 100
            },
            "documentation": {
               "type": "long_text",
               "default_value": "",
               "value": ""
            },
            "comments": {
               "type": "long_text",
               "default_value": "",
               "value": ""
            }
         }
      },
      "valve1": {
         "id": "valve1",
         "type": "valve",
         "label": "inflow",
         "centrex": 255,
         "centrey": 131.5,
         "text_shiftx": 0,
         "text_shifty": 19,
         "extras": {
            "equation": {
               "type": "long_text",
               "default_value": "",
               "value": "10"
            },
            "min_value": {
               "type": "short_text",
               "default_value": 0,
               "value": 0
            },
            "max_value": {
               "type": "short_text",
               "default_value": 10,
               "value": 10
            },
            "documentation": {
               "type": "long_text",
               "default_value": "",
               "value": ""
            },
            "comments": {
               "type": "long_text",
               "default_value": "",
               "value": ""
            }
         }
      },
      "cloud2": {
         "id": "cloud2",
         "type": "cloud",
         "label": "cloud2",
         "centrex": 483,
         "centrey": 133,
         "text_shiftx": 0,
         "text_shifty": 25,
         "extras": {
            "equation": {
               "type": "long_text",
               "default_value": "",
               "value": ""
            },
            "min_value": {
               "type": "short_text",
               "default_value": 0,
               "value": 0
            },
            "max_value": {
               "type": "short_text",
               "default_value": 100,
               "value": 100
            },
            "documentation": {
               "type": "long_text",
               "default_value": "",
               "value": ""
            },
            "comments": {
               "type": "long_text",
               "default_value": "",
               "value": ""
            }
         }
      },
      "valve2": {
         "id": "valve2",
         "type": "valve",
         "label": "outflow",
         "centrex": 411,
         "centrey": 132,
         "text_shiftx": 0,
         "text_shifty": 19,
         "extras": {
            "equation": {
               "type": "long_text",
               "default_value": "",
               "value": "outflow_coef*tank"
            },
            "min_value": {
               "type": "short_text",
               "default_value": 0,
               "value": 0
            },
            "max_value": {
               "type": "short_text",
               "default_value": 10,
               "value": 10
            },
            "documentation": {
               "type": "long_text",
               "default_value": "",
               "value": ""
            },
            "comments": {
               "type": "long_text",
               "default_value": "",
               "value": ""
            }
         }
      },
      "variable1": {
         "id": "variable1",
         "type": "variable",
         "label": "outflow_coef",
         "centrex": 386,
         "centrey": 181,
         "text_shiftx": 0,
         "text_shifty": 0,
         "extras": {
            "equation": {
               "type": "long_text",
               "default_value": "",
               "value": "0.05"
            },
            "min_value": {
               "type": "short_text",
               "default_value": 0,
               "value": 0
            },
            "max_value": {
               "type": "short_text",
               "default_value": 1,
               "value": 1
            },
            "documentation": {
               "type": "long_text",
               "default_value": "",
               "value": ""
            },
            "comments": {
               "type": "long_text",
               "default_value": "",
               "value": ""
            }
         }
      }
   },
   "arcs": {
      "flow1": {
         "id": "flow1",
         "type": "flow",
         "label": "flow1",
         "start_node_id": "cloud1",
         "end_node_id": "stock1",
         "curvature": 0.3,
         "along": 0.5,
         "select_state": "normal",
         "set_state": "set",
         "node_id": "valve1",
         "shape": "straight",
         "line_colour": "#a0a0a0",
         "line_width": 4,
         "fill_colour": "#a0a0a0",
         "arrowhead": {
            "shape": "diamond",
            "gap": 6,
            "width": 5,
            "front": 12,
            "back": 0
         }
      },
      "flow2": {
         "id": "flow2",
         "type": "flow",
         "label": "flow2",
         "start_node_id": "stock1",
         "end_node_id": "cloud2",
         "curvature": 0.3,
         "along": 0.5,
         "select_state": "normal",
         "set_state": "set",
         "node_id": "valve2",
         "shape": "straight",
         "line_colour": "#a0a0a0",
         "line_width": 4,
         "fill_colour": "#a0a0a0",
         "arrowhead": {
            "shape": "diamond",
            "gap": 6,
            "width": 5,
            "front": 12,
            "back": 0
         }
      },
      "influence1": {
         "id": "influence1",
         "type": "influence",
         "label": "influence1",
         "start_node_id": "stock1",
         "end_node_id": "valve2",
         "curvature": 0.3,
         "along": 0.5,
         "select_state": "normal",
         "set_state": "set",
         "shape": "curved",
         "line_colour": "#505050",
         "line_width": 1,
         "fill_colour": "#505050",
         "arrowhead": {
            "shape": "diamond",
            "gap": 2,
            "width": 3,
            "front": 10,
            "back": -2
         }
      },
      "influence2": {
         "id": "influence2",
         "type": "influence",
         "label": "influence2",
         "start_node_id": "variable1",
         "end_node_id": "valve2",
         "curvature": 0.3,
         "along": 0.5,
         "select_state": "normal",
         "set_state": "set",
         "shape": "curved",
         "line_colour": "#505050",
         "line_width": 1,
         "fill_colour": "#505050",
         "arrowhead": {
            "shape": "diamond",
            "gap": 2,
            "width": 3,
            "front": 10,
            "back": -2
         }
      }
   },
   "scenarios": {
      "default": {
         "simulation_settings": {
            "start_time": 0,
            "end_time": 100,
            "nstep": 100,
            "display_interval": 1,
            "integration_method": "euler1"
         }
      }
   }
}
